Hour,btc_online_users,btc_number_of_post,btc_comments,btc_total_votes,bitcoin_online_users,bitcoin_number_of_post,bitcoin_comments,bitcoin_total_votes,ethereum_online_users,ethereum_number_of_post,ethereum_comments,ethereum_total_votes,monero_online_users,monero_number_of_post,monero_comments,monero_total_votes,dashpay_online_users,dashpay_number_of_post,dashpay_comments,dashpay_total_votes,ethtrader_online_users,ethtrader_number_of_post,ethtrader_comments,ethtrader_total_votes,ethfinance_online_users,ethfinance_number_of_post,ethfinance_comments,ethfinance_total_votes,xmrtrader_online_users,xmrtrader_number_of_post,xmrtrader_comments,xmrtrader_total_votes
03/14/21 01:20 AM,1.3k,3,"[{'timestamp': '11 minutes ago', 'comments': '0', 'comments_on_post': []}, {'timestamp': '24 minutes ago', 'comments': '0', 'comments_on_post': []}, {'timestamp': '28 minutes ago', 'comments': '0', 'comments_on_post': []}]",1030,10.5k,15,"[{'timestamp': '4 minutes ago', 'comments': '0', 'comments_on_post': []}, {'timestamp': '9 minutes ago', 'comments': '2', 'comments_on_post': [""No idea. Hopefully it's temporary for you though."", 'Is the linked bank account in her name?']}, {'timestamp': '14 minutes ago', 'comments': '2', 'comments_on_post': ['Fuck you if you refuse to wear a mask in a closed air public place. Also fuck the antimaskers that will downvote this.', 'Absurd - BoA is trash']}, {'timestamp': '15 minutes ago', 'comments': '0', 'comments_on_post': []}, {'timestamp': '17 minutes ago', 'comments': '1', 'comments_on_post': ['So you wanna rich 100$ ?']}, {'timestamp': '21 minutes ago', 'comments': '2', 'comments_on_post': ['jesus christ. put in at least 3 minutes of effort to try and learn this info on your own. literally all these besides a subjective answer to the platform can be answered with a simple google search.', 'Alright well clearly the guy before me is really upset for no reason', 'No.', 'Not directly, but you can buy GBTC or BLOK or any stock associated to blockchain/Bitcoin']}, {'timestamp': '23 minutes ago', 'comments': '1', 'comments_on_post': ['that’s what I did.']}, {'timestamp': '33 minutes ago', 'comments': '5', 'comments_on_post': ['you want some money now or more money a year + from now? there’s your answer.', 'With day trading you need to consider taxes, and the time dedicated to watching. With DCA you buy a certain amount at a certain time and that is it. You can decide which one you want', 'Risk vs Reward', ""Depends which one you're better at."", ""Have a crystal ball? Day trade. Don't have one? DCA""]}, {'timestamp': '35 minutes ago', 'comments': '3', 'comments_on_post': ['No, saved everyone a click', 'Your reward for this service will be +3"". Enjoy.', 'No, if you thought they could send all your Bitcoin to me and never think about it again. PM me for address.']}, {'timestamp': '39 minutes ago', 'comments': '14', 'comments_on_post': ['Bitcoin will forever appreciate in value?', 'This ^', 'I have a family member who is GPU mining ETH but they say it pays them in BTC?', 'Definitely do not build a mining rig. I’m going to assume you know it can’t mine btc but can do other crypto. Margin over power costs is good now but for the last two years you would have made hardly anything gpu mining on home power costs and only reason the difficulty (mining competition) isn’t higher on rigs is that ethereum will be going proof of stake sooner rather than later which will nuke the profitability.', 'I see. Thanks for the info', 'What if you were completely solar, wind, or water powered, free, limitless power supply?']}, {'timestamp': '44 minutes ago', 'comments': '8', 'comments_on_post': [""You're so clueless about world timezones"", 'small brain only knows the word satoshi', 'People got paid yesterday and run a systematic purchase into the coin.', 'It started pumping around US boomer wake up time.', 'Jump was at 11:00 a.m. here in Germany.']}, {'timestamp': '49 minutes ago', 'comments': '5', 'comments_on_post': ['Who cares', 'Who cares about what some rich boomer thinks', 'This answer works for so many questions', 'archived article (why?):', ""No billionaires minted under the fiat currency regime will admire or promote bitcoin when doing so would help expedite their societal status. Think about. All 18.6 million bitcoin are already owned by folks and the only way they can get their hands on even a minority percentage of them is to significantly bid up the fiat price of BTC at which point they'd be making the true HODLers the new elite.""]}, {'timestamp': '54 minutes ago', 'comments': '19', 'comments_on_post': ['Get a job first. Then put money in after the responsible bills are paid.', 'Idk, it depends on how good you are for the money. I took out a lot for leverage and it has more than paid for itself. If the loan’s your only source of buying power, though, there may be a problem, lol.', ""lol... you get a job! i'm retired on btc long time ago!"", 'This is not the way', '4 years', 'Idk about that one', '1st loan says GO', 'just do the math...\nif you can pay for a bear market loan\nand DCA all the way with every loan and get new loans forever...\nLoan interest vs +200%/yr on BTC...']}, {'timestamp': '56 minutes ago', 'comments': '2', 'comments_on_post': ['Block reward plus fees go to the miner that won the block. That being said, that one miner is often part of a pool that spilts the rewards with all that tried.', 'Most mining is done in pools. Pool finds a block and pays out to all miners in that pool at the proportion of their contribution. In short, the higher your hashrate the more you can get paid.']}, {'timestamp': '57 minutes ago', 'comments': '68', 'comments_on_post': [""61k and it's just $1 for tx fee right now, might be a good time to open ln channels if you were waiting."", 'Seriously, y’all need to milk the mining stocks for profits that go into the coin. It’s getting me close to a 1/4th of a coin this week.', 'The mining stocks are way overvalued because their bitcoin business could never justify the valuation they are trading at. When the market realizes this, they will crash regardless of the bitcoin price.', 'Elaborate?', 'Explain.', 'Welp I’ve made more money with the $200 I put in Bitcoin two weeks ago than the 8k I put in the market 3 months ago.', ""It's so exhausting to see the same old, tired arguments against bitcoin. Or the suggestions for change. Or why another one is better."", 'What matters more? The number of sats you have or the number of USD they are worth.', 'Yes.', 'Sats 💯', 'Jordan B Peterson coming on board?', 'everyone is coming on board, in the end it will be obvious', 'Is there a way to see my average cost per Bitcoin through Cashapp? All I can see is how much I own and the total $ amount', 'There isn’t an easy way, but if you tap on each transaction, it will tell you the price Bitcoin was at when you bought. As long as you don’t mind doing the math at that point, you’ll have your average.', 'Add up how much you have spent and divide by the amount of BTC you have', 'How come Bitcoin has the ability to reach such a high number per coin, while other currencies don’t increase to these high values? How can we understand the intrinsic value of Bitcoin?', ""It's all in the scarcity, proof of work, and the distributed nature of the network."", ""Because there will only ever be so many bits. The supply is capped and the fundamentals of bitcoin and the application of it's properties create this beautiful technology that serves so many purposes."", '1 BTC = $0.06M', '12 straight hours above 60. 🐂', 'dunno if i trade the btc bought with stimulus for an yacht or an helicopter in 2025.', 'Yacht is my end game. Nothing fancy, something like this, https://www.fraseryachts.com/en/yacht-for-sale/forwin/', 'Surely you mean yacht or helicopter factory.', 'Why settle?', 'Are people really buying imaginary art rights on the blockchain for tens of millions of dollars each, or are they just wash selling and laundering money? If this is real I need to teach my ass some Adobe.', 'That is what I said. Wtf!! Now I need to switch into an art major', 'I’m mostly a bitcoin maximalist but NFTs don’t sound preposterous to me. Value is in the eye of the beholder so as long as they represent something people desire then they work as intended. Unlike bitcoin, they’re each unique and represent something like a piece of digital art. It’s just supply and demand.', 'Modern day shitcoinery', 'LMAO I got banned from r/buttcoin for laughing at them!!! 🤣🤣🤣', ""It's been hovering around 61000 for a few hours now. Wonder if we'll see a pump like last night!"", ""lots of people haven't actually got their stimulus. It's either still pending or won't arrive till Wednesday via the IRS tracking site for most. I already spent the $1400 all on bit on the 7th cause I had the liquid and I knew it was coming. However once those checks are in the hands of the people it's gonna help the pump."", 'That would be awesome. However, I’ve noticed the past few days that when it consolidates like this after pumping, it usually means it will dip unfortunately.', 'Should I buy in more now ?', ""yes. these 5k fluctuations aren't going to mean shit in two years."", 'Potential dip???', 'Forget a lambo, bitcoin is going to give me the gift of actually being with my future kids as they grow up instead of wasting away at a 9-5 and missing it. Thats all i want.', 'I’d still work I just want them to have an education', 'It’s about the kids 🙌🏽', 'Well said.', 'This is the way.', 'Riot Mara Gbtc is gonna be lit on Monday 🥳', 'GBTC might go up 2% smh', 'Bitcoin gives me something to live for', 'You need some more going on in your life probably the', 'I’ve got my next 1000 teed up and ready buy in but wouldn’t mind seeing a dip to 58-59 before pulling the trigger. I know it’s a fools errand to try to time the market but one has to think we’re due for a little pullback soon. This shits got me fuckin antsy.', 'I bought at 61000, expecting a bounce. We got consolidation...', ""I think you'll get it. Start to DCA in and if it drops fire away."", 'Not even considering selling until 5 million a coin 🌝. This is just a nice little start to the most explosive investment fireworks in history. The next decade is going to blow everyone’s minds.', 'See you in 2029!', 'Anyone check up on the fellas at r/buttcoin?', 'Schiffy as usual', 'salty as usual', 'Letssss gooooo...nxt stop 75k', 'Hello brothers. One word for everyone. HODL', 'Bitcoin', 'Never thought there is an entire subreddit that is in denial about the federal reserve.', 'Nice', 'Goodnight', 'I’m buying', 'LETS FUCKING GO', 'We in here']}]",4113,2.7k,1,"[{'timestamp': '56 minutes ago', 'comments': '1', 'comments_on_post': [""It doesn't""]}]",17278,1.0k,0,[],1439,172,0,[],494,2.0k,6,"[{'timestamp': '8 minutes ago', 'comments': '0', 'comments_on_post': []}, {'timestamp': '9 minutes ago', 'comments': '0', 'comments_on_post': []}, {'timestamp': '16 minutes ago', 'comments': '4', 'comments_on_post': ['Depending on where you stake, there may be penalties to withdraw, or you may not be able to withdraw at all.', ""Binance has staking pool where u get BETH in 1:1 ratio, I don't need to withdraw it for the next few years, however I do like to play with the risks and sell it on high and buy on low which may yield better APY"", 'Buy doge. Way of the future', 'Are u challenging me?']}, {'timestamp': '27 minutes ago', 'comments': '0', 'comments_on_post': []}, {'timestamp': '30 minutes ago', 'comments': '3', 'comments_on_post': ['Usually I would say split between btc and eth. But eth really seems a bit undervalued atm, so expect a jump toward 1:10 if btc ratio.', 'I buy and HODL!', 'I’d like people to explain their choices. It’s seems fairly spread out. No clear winner yet']}, {'timestamp': '39 minutes ago', 'comments': '0', 'comments_on_post': []}]",10787,331,1,"[{'timestamp': '14 minutes ago', 'comments': '7', 'comments_on_post': ['GLORY IS UPON US!', 'Ethere... ummmm', 'What do you think a out oi cycle top indicator?', 'Completely irresponsibly over-invested and it feels good.', 'Ethereum', 'Mister_Eth & sgad89', 'Eth']}]",1385,68,0,[],530
03/14/21 03:35 AM,975,0,[],1199,9.9k,7,"[{'timestamp': 'just now', 'comments': '0', 'comments_on_post': []}, {'timestamp': '2 minutes ago', 'comments': '0', 'comments_on_post': []}, {'timestamp': '5 minutes ago', 'comments': '1', 'comments_on_post': ['Good idea']}, {'timestamp': '19 minutes ago', 'comments': '2', 'comments_on_post': ['Swan Bitcoin', 'yes']}, {'timestamp': '47 minutes ago', 'comments': '16', 'comments_on_post': ['buy BTC. this is financial advice.', 'Historically, the market price of bitcoin has experienced sustained medium-term losses only after insane gains: vertical on a log scale. A long-term secular bear market in real terms is very possible, but, IMHO, that is years away. N.B. None of the preceding can be construed as financial advice.', 'Demand > Supply', 'Bitcoin does what Bitcoin does. For example gain 10x in the last 12months.', ""Stop thinking in terms of days, and instead years. When you think in terms of years, it's irrelevant whether the bitcoin you bought was purchased for $500 or $600 when the price is $60K."", 'I remember when McDonald’s double cheese burgers were a dollar.... now they are like double the price', 'Generally it is used as a store of value these days. One of the big draws is the fact that it is deflationary, as the mount of new bitcoin created cuts in half every 4 years, and there will only ever be 21 million coins.', 'The best way is to invest with a broker', 'You will get profit at most times', 'Bitcoin is worth what the market says it worth. What it will be worth in the future is all speculation.', 'It’s speculation. All other arguments in either direction are wishful thinking.', ""Are you sure that isn't just wishful thinking?"", 'Jesus fuck use google ffs', 'Omg great user name. Yeah so no one on Reddit knows how to google... anything.', ""There's so much information out there, how am I supposed to know what's reliable or not. Asking here is essentially the same as google. So how about try not being a prick? Or is that about as impossible as my ability to google?""]}, {'timestamp': '48 minutes ago', 'comments': '0', 'comments_on_post': []}, {'timestamp': '56 minutes ago', 'comments': '7', 'comments_on_post': ['Look at r/binancesupporttickets', 'Yep. Fees can be a bit high to withdraw though. Never had any problems myself.', 'How much they take?', ""If it works where you live it works ok. Doesn't work in US.""]}]",5380,3.0k,0,[],17259,1.2k,0,[],862,128,0,[],498,1.8k,3,"[{'timestamp': '26 minutes ago', 'comments': '0', 'comments_on_post': []}, {'timestamp': '32 minutes ago', 'comments': '0', 'comments_on_post': []}, {'timestamp': '40 minutes ago', 'comments': '1', 'comments_on_post': ['Ha, nice!']}]",11237,409,0,[],1388,84,0,[],661
03/14/21 04:52 AM,1.0k,1,"[{'timestamp': '56 minutes ago', 'comments': '5', 'comments_on_post': ['What you are talking about are traditionally called remittance.', 'The term ""settlement layer"" is invented in the world of Bitcoin BTC as part of the narrative that most people do not need to interact directly on the blockchain, but use second layer solutions like the lightning network. In that case, transactions do not happen on chain, but the aggregate sum of many transactions may at some point be ""settled"" on the chain.\nIn their case, ""settlement layer"" is synonymous to the blockchain.\nIn Bitcoin BCH world, there is no need for secondary layer solutions, everybody transacts directly on the blockchain, and all transactions are ""settled"" within the next few blocks.', 'The term ""settlement layer"" is invented in the world of Bitcoin BTC']}]",1071,10.5k,10,"[{'timestamp': '3 minutes ago', 'comments': '0', 'comments_on_post': []}, {'timestamp': '6 minutes ago', 'comments': '0', 'comments_on_post': []}, {'timestamp': '7 minutes ago', 'comments': '4', 'comments_on_post': ['3045', 'Was hoping 2030. That’s what I was hoping for.', 'Tommorow', 'Creative!👍', 'https://digitalik.net/btc/', 'october 2024']}, {'timestamp': '17 minutes ago', 'comments': '4', 'comments_on_post': ['Interesting,', 'Canada TD Bank.', 'I just got a mortgage 2 months ago in Canada and was advised Canadian banks aren’t allowed to use Bitcoin as a source of the Down Payment / part of the portfolio. This was from RBC, TD, BMO and a mortgage broker.', 'Also just screenshotted my Voyager account for a personal loan too.', ""rocket mortgage won't touch anything bitcoin related. guy is trying to make me launder it through my dad so it looks like a gift. I'm checking with a few other lenders now.""]}, {'timestamp': '18 minutes ago', 'comments': '6', 'comments_on_post': ['Usd??', 'Yes']}, {'timestamp': '20 minutes ago', 'comments': '0', 'comments_on_post': []}, {'timestamp': '39 minutes ago', 'comments': '2', 'comments_on_post': ['denier? lol fuck off bootlicking troll. do you call shitcoiners ""bitcoin deniers""? what do you call trump supporters? ""democrat deniers""? lol what a joke you are.', 'Are they dumb enough to not know the difference between ""to lose"" and ""to loose?""']}, {'timestamp': '41 minutes ago', 'comments': '1', 'comments_on_post': ['Did you get email confirmations on your buys/trades? Also, you should really consider using a different platform. Coinbase charges loads in fees!']}, {'timestamp': '48 minutes ago', 'comments': '3', 'comments_on_post': ['offshore banks also have the necessary aml kyc n transactions monitoring measures obligations in place n i assure u when a huge sum of incoming funds transferred from overseas reaching your account, they will and must review.', 'But someone like me, who never had the name blacklisted anyware, good credit score in UK and with the printing documentation from the transactions in the bitcoin exchenge, would the AML and KYC policies affect heavly?']}, {'timestamp': '54 minutes ago', 'comments': '14', 'comments_on_post': ['My guess. Steady climb to 70-80k before next dip.', 'When you say dip do you mean crash or dip... i’m cool with 30-40% “dips”... just wondering if theres gonna be a crash for like 3 years again', 'what i read so far is average 4 years and this year the expectations of a correction occurring in 2nd half of the year is gaining traction', 'Thank you... correction is chill, just gotta make a plan based on this fact', ""the bitcoin bull run has lasted 12 years so far. Given that bitcoin keeps quantitatively hardening and fiat keeps quantitatively easing, I'd say it the bull run will continue for a few more years at least"", 'The dips are becoming smaller and less frequent. Invest more in Bitcoin. This is financial advice.', 'Buy the dip and tip. Hold until old.', 'Pull up the long term chart on Tradingview and see for yourself. Ticker = BLX.', 'I mean why does the bull run have to end 😉?', 'It could go on for a year or less. Its part of the market cycle. All ways be ready for each scenario.', 'So the whole rise could die in a year? Like crash to 7k and remain there until next halfing (assuming previous history?)', 'I dont understand when the bull run ended. Its had a steady enormous annual increase forever. From 2017 to 2021 its gone up $40k. When was the bare market.']}]",5171,3.2k,3,"[{'timestamp': '10 minutes ago', 'comments': '0', 'comments_on_post': []}, {'timestamp': '27 minutes ago', 'comments': '2', 'comments_on_post': ['Something tells me there are going to be some NFT bag holders one day', 'Why does anyone think that someone else is going to want to buy this stuff from them? This is the ‘greater fool’ concept taken to extremes.']}, {'timestamp': '35 minutes ago', 'comments': '2', 'comments_on_post': ['Ok turn the drips on. Thank you.', 'Nice ambition']}]",17060,1.2k,2,"[{'timestamp': '7 minutes ago', 'comments': '1', 'comments_on_post': ['wow, nice, stonks']}, {'timestamp': '17 minutes ago', 'comments': '18', 'comments_on_post': ['for some reason I sent r/boato11 it and now I gotta wait 20 mins to send more :( ill make sure i send the first 10 my brothers HODDDDLL', 'RemindMe! 20 Year', ""Don't worry, you're a legend! Hope you wrote down the top 10 lol How is the mining going?"", '83RVSrcoUC2SirBJY8cCDzLqPG8nr1fQSEMqV4ZnbYNGAFd5BA11nAn7qvgb6AgPSDW4nQdvefc6t57asfsszNja57BjpmN', 'sent my brother hodl to the moon <3', '87hKzshB85pfeoB9qodY92dS3UdvRFnZxHpTWKSAnew24W6eMmk6dj433NoSwbt7pG7iAbkm8rjRFX5nsXiZ2mCaFCK7x8k', '8544MVdfcF72Cycxzcy1EcfVDdPFNarXwNbLiXZuy3R53fK771Ccn2q59UoXD9MFd491uUC2TrmJLBJejqKxyuAUJDtbgKH', '8B7LYVqZmuL17evZJmDwTWCLiDiE8J2x21VB1PnB85NURAMCcY1s4ujYtLkFJXtBbN3s5AB9bayKYWtSqHSpncGkEncRcKM', '8Bdvyg3MTsvDEaR73YGN9S8AZkWMF8VtXBmSufTnTT6X2JGQKa68AQBHUqfBpsyVkihrbMXWdvQKkDKmDd1a7dRa5Qqxrjp', '48UHSY8FvAQWH3XK3kFm7UL67NhckuTC3iyJRcMirFEtAs5RCwTMFqpXf2pdvWJKs9LqBFAg9p8C54B8mz996owYCSz7PgA', '42qoMAkeAiwXKmAJJVhYtj7mVQy1ahmvk6x2nTwCXZhsFvG3waYKV1c4nXpCAzbnut5CDWE213K67Rbr2w83LBd3GSbpUUi', 'Thank you for this <3', 'alright we hit the limit boys that was quick hahaaha :))) love you legends lots', '892YPBLcfKB1HMwEbmL7KLiK56VLxkyVv2HGayRbSa2qhYo3AmEQo6gDWPP7ogkwv4agsbavwytd7HbPPjgyfKhn2DdQtC2', '2 more ppl and we done ahaha quicklyyyy XD']}]",875,151,0,[],573,2.0k,4,"[{'timestamp': '1 minute ago', 'comments': '0', 'comments_on_post': []}, {'timestamp': '19 minutes ago', 'comments': '0', 'comments_on_post': []}, {'timestamp': '21 minutes ago', 'comments': '1', 'comments_on_post': ['This is amazing progress actually, more than 1B locked in the platform in the last months, recpect']}, {'timestamp': '43 minutes ago', 'comments': '4', 'comments_on_post': ['The gas fees sure let me down', 'Things will get better . Just patience', 'Never gonna ETH you up', 'Lol']}]",10907,409,0,[],1425,127,1,"[{'timestamp': '46 minutes ago', 'comments': '0', 'comments_on_post': []}]",438
