Hour,btc_online_users,btc_number_of_post,btc_comments,btc_total_votes,bitcoin_online_users,bitcoin_number_of_post,bitcoin_comments,bitcoin_total_votes,ethereum_online_users,ethereum_number_of_post,ethereum_comments,ethereum_total_votes,monero_online_users,monero_number_of_post,monero_comments,monero_total_votes,dashpay_online_users,dashpay_number_of_post,dashpay_comments,dashpay_total_votes,ethtrader_online_users,ethtrader_number_of_post,ethtrader_comments,ethtrader_total_votes,ethfinance_online_users,ethfinance_number_of_post,ethfinance_comments,ethfinance_total_votes,xmrtrader_online_users,xmrtrader_number_of_post,xmrtrader_comments,xmrtrader_total_votes
03/14/21 04:57 PM,1.0k,1,"[{'timestamp': '56 minutes ago', 'comments': '5', 'comments_on_post': ['What you are talking about are traditionally called remittance.', 'The term ""settlement layer"" is invented in the world of Bitcoin BTC as part of the narrative that most people do not need to interact directly on the blockchain, but use second layer solutions like the lightning network. In that case, transactions do not happen on chain, but the aggregate sum of many transactions may at some point be ""settled"" on the chain.\nIn their case, ""settlement layer"" is synonymous to the blockchain.\nIn Bitcoin BCH world, there is no need for secondary layer solutions, everybody transacts directly on the blockchain, and all transactions are ""settled"" within the next few blocks.', 'The term ""settlement layer"" is invented in the world of Bitcoin BTC']}]",1071,10.5k,10,"[{'timestamp': '3 minutes ago', 'comments': '0', 'comments_on_post': []}, {'timestamp': '6 minutes ago', 'comments': '0', 'comments_on_post': []}, {'timestamp': '7 minutes ago', 'comments': '4', 'comments_on_post': ['3045', 'Was hoping 2030. That’s what I was hoping for.', 'Tommorow', 'Creative!👍', 'https://digitalik.net/btc/', 'october 2024']}, {'timestamp': '17 minutes ago', 'comments': '4', 'comments_on_post': ['Interesting,', 'Canada TD Bank.', 'I just got a mortgage 2 months ago in Canada and was advised Canadian banks aren’t allowed to use Bitcoin as a source of the Down Payment / part of the portfolio. This was from RBC, TD, BMO and a mortgage broker.', 'Also just screenshotted my Voyager account for a personal loan too.', ""rocket mortgage won't touch anything bitcoin related. guy is trying to make me launder it through my dad so it looks like a gift. I'm checking with a few other lenders now.""]}, {'timestamp': '18 minutes ago', 'comments': '6', 'comments_on_post': ['Usd??', 'Yes']}, {'timestamp': '20 minutes ago', 'comments': '0', 'comments_on_post': []}, {'timestamp': '39 minutes ago', 'comments': '2', 'comments_on_post': ['denier? lol fuck off bootlicking troll. do you call shitcoiners ""bitcoin deniers""? what do you call trump supporters? ""democrat deniers""? lol what a joke you are.', 'Are they dumb enough to not know the difference between ""to lose"" and ""to loose?""']}, {'timestamp': '41 minutes ago', 'comments': '1', 'comments_on_post': ['Did you get email confirmations on your buys/trades? Also, you should really consider using a different platform. Coinbase charges loads in fees!']}, {'timestamp': '48 minutes ago', 'comments': '3', 'comments_on_post': ['offshore banks also have the necessary aml kyc n transactions monitoring measures obligations in place n i assure u when a huge sum of incoming funds transferred from overseas reaching your account, they will and must review.', 'But someone like me, who never had the name blacklisted anyware, good credit score in UK and with the printing documentation from the transactions in the bitcoin exchenge, would the AML and KYC policies affect heavly?']}, {'timestamp': '54 minutes ago', 'comments': '14', 'comments_on_post': ['My guess. Steady climb to 70-80k before next dip.', 'When you say dip do you mean crash or dip... i’m cool with 30-40% “dips”... just wondering if theres gonna be a crash for like 3 years again', 'what i read so far is average 4 years and this year the expectations of a correction occurring in 2nd half of the year is gaining traction', 'Thank you... correction is chill, just gotta make a plan based on this fact', ""the bitcoin bull run has lasted 12 years so far. Given that bitcoin keeps quantitatively hardening and fiat keeps quantitatively easing, I'd say it the bull run will continue for a few more years at least"", 'The dips are becoming smaller and less frequent. Invest more in Bitcoin. This is financial advice.', 'Buy the dip and tip. Hold until old.', 'Pull up the long term chart on Tradingview and see for yourself. Ticker = BLX.', 'I mean why does the bull run have to end 😉?', 'It could go on for a year or less. Its part of the market cycle. All ways be ready for each scenario.', 'So the whole rise could die in a year? Like crash to 7k and remain there until next halfing (assuming previous history?)', 'I dont understand when the bull run ended. Its had a steady enormous annual increase forever. From 2017 to 2021 its gone up $40k. When was the bare market.']}]",5171,3.2k,3,"[{'timestamp': '10 minutes ago', 'comments': '0', 'comments_on_post': []}, {'timestamp': '27 minutes ago', 'comments': '2', 'comments_on_post': ['Something tells me there are going to be some NFT bag holders one day', 'Why does anyone think that someone else is going to want to buy this stuff from them? This is the ‘greater fool’ concept taken to extremes.']}, {'timestamp': '35 minutes ago', 'comments': '2', 'comments_on_post': ['Ok turn the drips on. Thank you.', 'Nice ambition']}]",17060,1.2k,2,"[{'timestamp': '7 minutes ago', 'comments': '1', 'comments_on_post': ['wow, nice, stonks']}, {'timestamp': '17 minutes ago', 'comments': '18', 'comments_on_post': ['for some reason I sent r/boato11 it and now I gotta wait 20 mins to send more :( ill make sure i send the first 10 my brothers HODDDDLL', 'RemindMe! 20 Year', ""Don't worry, you're a legend! Hope you wrote down the top 10 lol How is the mining going?"", '83RVSrcoUC2SirBJY8cCDzLqPG8nr1fQSEMqV4ZnbYNGAFd5BA11nAn7qvgb6AgPSDW4nQdvefc6t57asfsszNja57BjpmN', 'sent my brother hodl to the moon <3', '87hKzshB85pfeoB9qodY92dS3UdvRFnZxHpTWKSAnew24W6eMmk6dj433NoSwbt7pG7iAbkm8rjRFX5nsXiZ2mCaFCK7x8k', '8544MVdfcF72Cycxzcy1EcfVDdPFNarXwNbLiXZuy3R53fK771Ccn2q59UoXD9MFd491uUC2TrmJLBJejqKxyuAUJDtbgKH', '8B7LYVqZmuL17evZJmDwTWCLiDiE8J2x21VB1PnB85NURAMCcY1s4ujYtLkFJXtBbN3s5AB9bayKYWtSqHSpncGkEncRcKM', '8Bdvyg3MTsvDEaR73YGN9S8AZkWMF8VtXBmSufTnTT6X2JGQKa68AQBHUqfBpsyVkihrbMXWdvQKkDKmDd1a7dRa5Qqxrjp', '48UHSY8FvAQWH3XK3kFm7UL67NhckuTC3iyJRcMirFEtAs5RCwTMFqpXf2pdvWJKs9LqBFAg9p8C54B8mz996owYCSz7PgA', '42qoMAkeAiwXKmAJJVhYtj7mVQy1ahmvk6x2nTwCXZhsFvG3waYKV1c4nXpCAzbnut5CDWE213K67Rbr2w83LBd3GSbpUUi', 'Thank you for this <3', 'alright we hit the limit boys that was quick hahaaha :))) love you legends lots', '892YPBLcfKB1HMwEbmL7KLiK56VLxkyVv2HGayRbSa2qhYo3AmEQo6gDWPP7ogkwv4agsbavwytd7HbPPjgyfKhn2DdQtC2', '2 more ppl and we done ahaha quicklyyyy XD']}]",875,151,0,[],573,2.0k,4,"[{'timestamp': '1 minute ago', 'comments': '0', 'comments_on_post': []}, {'timestamp': '19 minutes ago', 'comments': '0', 'comments_on_post': []}, {'timestamp': '21 minutes ago', 'comments': '1', 'comments_on_post': ['This is amazing progress actually, more than 1B locked in the platform in the last months, recpect']}, {'timestamp': '43 minutes ago', 'comments': '4', 'comments_on_post': ['The gas fees sure let me down', 'Things will get better . Just patience', 'Never gonna ETH you up', 'Lol']}]",10907,409,0,[],1425,127,1,"[{'timestamp': '46 minutes ago', 'comments': '0', 'comments_on_post': []}]",438
03/15/21 01:15 AM,1.3k,2,"[{'timestamp': '25 minutes ago', 'comments': '0', 'comments_on_post': []}, {'timestamp': '59 minutes ago', 'comments': '2', 'comments_on_post': ['Clever']}]",522,10.0k,9,"[{'timestamp': '5 minutes ago', 'comments': '4', 'comments_on_post': ['https://opensea.io/accounts/robux', 'Yes I can explain it... your mom makes it go up.', 'Real mature, fkin loser.']}, {'timestamp': '8 minutes ago', 'comments': '2', 'comments_on_post': ['So whomever holds it last gets paid', 'Safemoon!!!']}, {'timestamp': '27 minutes ago', 'comments': '4', 'comments_on_post': ['Read this in five years when Bitcoin is worth a mill', 'It’s not going to hurt anything buying now on the ap and xfering later.', 'I’m new to this as wel! But don’t you pay transaction fees for buying Bitcoin in any case? Before you can move your btc to your wallet', 'Put all your $ on both btc and eth and leave it there. Whenever you can add some do it. Look at it again in 6 month time, you will be very happy. Im not a financial advisor, this is just my dumb ape opinion. Its only going up from here :)']}, {'timestamp': '33 minutes ago', 'comments': '6', 'comments_on_post': ['Da fuk is warren buffet?', 'Warren was always playing 4d checkers. Who is the rat? 🤔', 'What the fuck is this a buffet', 'bitcoin buffet', 'Jimmy buffett cheeseburgers', 'Should have bought Faangs he rekt']}, {'timestamp': '52 minutes ago', 'comments': '0', 'comments_on_post': []}, {'timestamp': '53 minutes ago', 'comments': '2', 'comments_on_post': ['Listen, can you imagine giving how many thousands of bitcoin for 2 pizzas or whatever? I don’t even know how I’d ever forgive myself.. ugh', 'That’s meaningless. It’s like saying someone sold Apple or Tesla shares some time ago for much less than what they are valued today. They got what the value was as at when they let go of them that’s all.']}, {'timestamp': '53 minutes ago', 'comments': '0', 'comments_on_post': []}, {'timestamp': '55 minutes ago', 'comments': '19', 'comments_on_post': ['Can you still afford to get the surgery if your $2k is only worth $1k in 10 months? What if it was worth $0k?', ""Yeah I have enough time and an emergency fund to make up for the loss if that happens, but the majority response is that it's a batshit naive idea so I'm going to think long and hard."", 'Let me rephrase that for you.', 'This NEEDS to be at the top. OP just sounds childishly optimistic and naive imo.', ""In terms of investing, 9 months is not a long time. With such a short time frame, you're basically gambling. If you could leave it in BTC and not touch it for 3-5+ years, I might say to go for it."", ""Yeah, fair enough. I usually wouldn't have bothered asking but sometimes you just need a solid slappin' to set you right. Thanks for not being a dick about it!"", ""Personally I would just keep it as it is in fiat. Sods law say the minute you need the fiat funds something dramatic will happen and the market will dip. If it stays higher than your entry point everything is great. If it doesn't you have to fork out the difference."", 'Yeah I see your point.', 'Send it!', ""Never invest something you can't afford to lose."", ""I could tolerate the loss, it wouldn't be pleasant but I have enough time and an emergency fund that could make up for it. But still, ppl no likey the idea and I trust a majority ruling more than my own hunger for the SATS."", 'sure sounds like advice about investments to me...', 'ill do your surgery for $6,000 if youd like, that way you can invest $2,000 into bitcoin ! weeeeeee !!', ""Awesome I'll meet you out behind the shed"", 'I’m probably going to get massively downvoted, but you could buy stable coins and put those into an interest bearing account that pays out BTC. I use Nexo.', 'why would you get downvoted over this ? this is good advice. use blockfi though, higher interest', 'I did this with wedding money and then 2018 happened.', 'Oof... Courthouse wedding for you, I take it?']}, {'timestamp': '58 minutes ago', 'comments': '13', 'comments_on_post': ['If it stops running, then worry', ""well i figured that much, but i want to prevent it from not running at all since if I burn out this card I won't be able to get a new one"", 'i recommend you to investigate better. at nicehash you are not mining bitcon. you are mining other coins and get bitcoin from nicehash for that. but try r/EtherMining', ""well right now that's not really my main issue. my main issue is what I typed in the post"", 'Nicehash is garbage. Suboptimal profits in these conditions and bad for the space. Stop selling your hashpower to the highest bidder and just mine something directly.', 'again, not the question', 'Try r/nicehash']}]",40220,3.2k,0,[],1152,1.0k,0,[],1701,201,0,[],471,1.1k,3,"[{'timestamp': '7 minutes ago', 'comments': '1', 'comments_on_post': [""Hahaha that's awesome friend!""]}, {'timestamp': '35 minutes ago', 'comments': '1', 'comments_on_post': ['tldr; Blockchain-based decentralized finance (DeFi) has grown from a market of around $700 million in January 2020 to $15 billion just a year later. DeFi is designed to replace the role of banks with blockchain-based protocols. ""DeFi\'s high yield that doesn\'t exist in the traditional financial space is alluring,"" analyst Martin Gaspar said.']}, {'timestamp': '56 minutes ago', 'comments': '1', 'comments_on_post': ['tldr; A new proposal, EIP-3368, has emerged amid opposition from miners to scheduled changes to the network’s fee market. The proposal advocates that block rewards immediately be increased to 3 Ether and then reduced to 1 Ether over the two years following the implementation of EIP 1559. However, the proposal appears to have secured little support from the community.']}]",623,308,0,[],4131,80,0,[],961
03/16/21 03:10 AM,1.2k,3,"[{'timestamp': '37 minutes ago', 'comments': '0', 'comments_on_post': []}, {'timestamp': '44 minutes ago', 'comments': '0', 'comments_on_post': []}, {'timestamp': '57 minutes ago', 'comments': '2', 'comments_on_post': [""My advice: don't smoke in a coal mine. There's methane gas and coal dust in the air, making it a rather explosive environment."", ""I don't notice that brother thanks for the advice""]}]",907,9.7k,9,"[{'timestamp': '1 minute ago', 'comments': '0', 'comments_on_post': []}, {'timestamp': '4 minutes ago', 'comments': '0', 'comments_on_post': []}, {'timestamp': '4 minutes ago', 'comments': '0', 'comments_on_post': []}, {'timestamp': '10 minutes ago', 'comments': '8', 'comments_on_post': ['Normal banking uses shitloads to', 'Plus the offices they need and computers for employees etc etc plus the employees commuting', 'Well that’s like whataboutism isn’t it?', 'Using slot of unused electricity, using way less then fiat/banking etc. and encouraging sustainable mining.', 'Have Fun Staying Poor', 'Yip, how much power do all the banks use...', 'Detractors', 'BTC requires cheap energy by design. Most miners will use „waste“ energy (energy that is essentially left over), because it’s as cheap as it gets. I have seen some promising solar setups aswell, although there is a lot of development to be done in that field.']}, {'timestamp': '27 minutes ago', 'comments': '0', 'comments_on_post': []}, {'timestamp': '29 minutes ago', 'comments': '2', 'comments_on_post': ['USA etf later this year will be a craze', '🤞🏻🤞🏻']}, {'timestamp': '33 minutes ago', 'comments': '4', 'comments_on_post': ['This is the cringiest shit I’ve seen in a while. Imagine trying this hard to impress internet strangers lmao', ""I don't even know what this is a commercial for"", 'Gay af', ""Is this really what people aspire to? It's cringe af.""]}, {'timestamp': '47 minutes ago', 'comments': '7', 'comments_on_post': ['Just wait it will dip even more', 'How low can ya go, can ya go real low.', 'I’m so upset, money transfer isn’t gonna hit my exchange till Friday. Hope it’s still dipping by then.', 'If it mirrors the last dip the other week then hopefully it’ll go down to around the £32-35k.....', 'Hush, hush, my stimmy doesn’t arrive until Wednesday.', 'I have no more central bank issued shitcoins to trade. :(', 'Not yet dude, will buy again at 42k!']}, {'timestamp': '52 minutes ago', 'comments': '3', 'comments_on_post': ['Do you realize what this means??', 'Wow for real I didn’t do the maths, I‘m some kind of a millionaire now!', 'That’s a smooth 10€ every time btc goes up 1000€']}]",100864,2.8k,1,"[{'timestamp': '6 minutes ago', 'comments': '0', 'comments_on_post': []}]",11618,1.0k,0,[],1970,130,1,"[{'timestamp': '11 minutes ago', 'comments': '0', 'comments_on_post': []}]",489,1.2k,7,"[{'timestamp': '14 minutes ago', 'comments': '1', 'comments_on_post': [""No it isn't, but when you search a coin to do 100x, you rather search a coin with a low market cap. But the risks are higher for these projects. Investing in ETH is a no-brainer, investing in small projects needs intense research.""]}, {'timestamp': '19 minutes ago', 'comments': '2', 'comments_on_post': [""wow. so you took a gift of five BTC and put it into Ethereum? I don't understand."", 'Sorry for confusion, 500 in btc, will make an edit. Was a birthday gift. Was meant to play around with as I’ve been getting into crypto lately.']}, {'timestamp': '21 minutes ago', 'comments': '0', 'comments_on_post': []}, {'timestamp': '22 minutes ago', 'comments': '2', 'comments_on_post': [""Can't see it being required but who really knows I'm just a dude on reddit"", 'What about the fact that sharding will only support the data layer and the rest will still be sent to eth1 for execution (or rollups)?']}, {'timestamp': '31 minutes ago', 'comments': '0', 'comments_on_post': []}, {'timestamp': '36 minutes ago', 'comments': '0', 'comments_on_post': []}, {'timestamp': '44 minutes ago', 'comments': '0', 'comments_on_post': []}]",773,535,0,[],2568,88,1,"[{'timestamp': 'just now', 'comments': '0', 'comments_on_post': []}]",745
03/16/21 04:12 AM,924,2,"[{'timestamp': '5 minutes ago', 'comments': '0', 'comments_on_post': []}, {'timestamp': '21 minutes ago', 'comments': '0', 'comments_on_post': ['is this tournament connected to bch directly?', 'Not officially, just having some fun.', 'How many votes were there in total last year?', ""Early rounds didn't have too many, around 100 each game. As the rounds went on, hundreds and then more than a thousand in the final 2 rounds. Hope more this time!"", 'Voted']}]",723,10.0k,15,"[{'timestamp': '2 minutes ago', 'comments': '0', 'comments_on_post': []}, {'timestamp': '8 minutes ago', 'comments': '3', 'comments_on_post': [""This won't age well here.."", ""That's way too spread out, you should have greater than 50% in BTC and probably more in ETH. The others arent going to go that far imo."", 'This seems like more of an experiment to see how fast a thread can be auto removed..']}, {'timestamp': '8 minutes ago', 'comments': '0', 'comments_on_post': []}, {'timestamp': '13 minutes ago', 'comments': '0', 'comments_on_post': []}, {'timestamp': '13 minutes ago', 'comments': '2', 'comments_on_post': ['Welcome.', 'Oh and I forgot to write the second part: why I am very bullish, so here it goes, its very simple. Tesla bought bitcoins. Mostly just because Elon is crypto believer, but does not matter. Once other tech giants get this, they will probably buy in too. Some big investment firms are FOMOing into bitcoin now as well. Once this becomes a common, acceptable currency, everyone will want to buy in (probably this is rather slow event over decades). They wont even care anymore why - it just becomes currency as any other', 'Another kool-aid drinker... Nice 😎']}, {'timestamp': '18 minutes ago', 'comments': '4', 'comments_on_post': ['Try kraken', 'Try Shakepay, that’s what I use.', ""I'm not Canadian...will that be a problem?"", 'Try linking the card to Cash App and buy through there. Hopefully it works, usually the card has to be linked to a bank account but you never know.']}, {'timestamp': '18 minutes ago', 'comments': '0', 'comments_on_post': []}, {'timestamp': '21 minutes ago', 'comments': '2', 'comments_on_post': ['You’d lost more in fees like that', ""Lighting may be your answer, I'm pretty knew so other commenters may correct me.""]}, {'timestamp': '34 minutes ago', 'comments': '5', 'comments_on_post': ['There are many other exchanges and wallets to explore as a UK person.', 'Thank you very much.', 'Ledger had their marketing database hacked a year ago, which included the emails, phone numbers, and shipping addresses of customers who had purchased directly through the ledger site.', 'Thanks. I use android and was weighing up between the two. Can you move from a mobile wallet to cold storage? I was going to use an online wallet for the first few weeks until the amount invested passes £1000 then move it over to cold storage.']}, {'timestamp': '36 minutes ago', 'comments': '5', 'comments_on_post': ['If you want cold storage - which is the best - you should have a look to either Ledger or Trezor. I had the 2 of them, but I prefer Trezor... Once you have it, you will need to configure it and it will generate for you a Seed (12 or 24 words). keep those very secure and private. Never enter them on any website (especially if a website asks for you to do so...). Those are the keys to access your crypto.', 'Oh my goodness, this is amazing thank you so much.', 'Here', 'Thank you kindly!']}, {'timestamp': '38 minutes ago', 'comments': '7', 'comments_on_post': ['are you looking at quoted volume in usd or btc units? because obviously as the value goes up (because supply is constrained), the volume will tend to go down in btc units. in dollar value, volume is going up.', 'I’m looking at USD and GBP']}, {'timestamp': '43 minutes ago', 'comments': '7', 'comments_on_post': ['Even if government would go back to backing their currencies (very unlikely) Bitcoin will still be far superior! If governments would create an equal solution (even less likely) I don’t mind switching', ""Governments backing their currencies with gold again just isn't happening, unless there is a complete removal of the current ruling class."", ""govt can't fix their currency. as soon as you realize that, you'll understand what's really going on here."", 'I think making Bitcoin illegal would crash it in the short term, but drive it higher in the long term. I don’t see it killing Bitcoin. I don’t see this happening at all though.', 'would this effectively devalue Bitcoin?']}, {'timestamp': '44 minutes ago', 'comments': '3', 'comments_on_post': ['I have been thinking also that it isn’t just the money directly invested from the stimulus but the fact that the stimulus would curb people from selling the bitcoin that they currently have on expenses that come up.', 'Yeah, 100%, there are several secondary factors like that too.', ""It's not just streams from the stimulus that will start pouring in. The stimulus is an incentive for people with a lot of cash to protect that wealth and they will do so by buying up more hard assets. Real estate, stock, etc. Some of that will flow into Bitcoin.""]}, {'timestamp': '56 minutes ago', 'comments': '14', 'comments_on_post': ['Long term of course!! You are still early', '5 years from now you’re going to wish you invested today. 60k now is cheap compared to what it’ll be in the future.', ""You are in the middle of a dip... 55k is a good price. It'll be 100k in December. Just get in already"", 'I did buy into it a little when it was at like 43k, yall said itll be 50k by march and yall yet to fail me', 'https://old.reddit.com/r/Bitcoin/search?q=too+late&restrict_sr=on', 'Yes invest now trust your instincts', '60k or 50k doesn’t matter dollar cost average. The people who waited at 10 dollars did at 100 then 1000. They are the same ones waiting now. You going to go ahead and wait for it to be 100k or more. Break it down their is only 21 million bitcoin. 1 is better then none. So is .0001 or whatever. You could risk it for the biscuit and wait for a bear market crash and lump sum buy. No one knows the day the time or how low it will go tho. Crypto is still early.', 'I wanted to wait and see if a bear will happen but will probably buy in before August max', ""It's never too late"", 'Maybe.', 'It’s never to late!!', 'Just buy a few BTC they are cheap AF']}, {'timestamp': '58 minutes ago', 'comments': '0', 'comments_on_post': []}]",2654,2.7k,3,"[{'timestamp': 'just now', 'comments': '0', 'comments_on_post': []}, {'timestamp': '16 minutes ago', 'comments': '0', 'comments_on_post': []}, {'timestamp': '22 minutes ago', 'comments': '2', 'comments_on_post': ['Increase the gas limit', 'Your using Uniswap right?']}]",11793,953,0,[],1825,278,0,[],582,1.1k,5,"[{'timestamp': '7 minutes ago', 'comments': '0', 'comments_on_post': []}, {'timestamp': '13 minutes ago', 'comments': '1', 'comments_on_post': ['BUILD ON ETHEREUM']}, {'timestamp': '19 minutes ago', 'comments': '1', 'comments_on_post': ['Nft build on ETHEREUM']}, {'timestamp': '29 minutes ago', 'comments': '1', 'comments_on_post': [""'Mobile sync' what is that?""]}, {'timestamp': '50 minutes ago', 'comments': '3', 'comments_on_post': ['Ugh dude me too it’s ridiculous', 'Just wait until you find out about donuts...', ""you can't stop this addiction""]}]",740,368,0,[],2557,69,0,[],982
