Hour,btc_online_users,btc_number_of_post,btc_comments,btc_total_votes,bitcoin_online_users,bitcoin_number_of_post,bitcoin_comments,bitcoin_total_votes,ethereum_online_users,ethereum_number_of_post,ethereum_comments,ethereum_total_votes,monero_online_users,monero_number_of_post,monero_comments,monero_total_votes,dashpay_online_users,dashpay_number_of_post,dashpay_comments,dashpay_total_votes,ethtrader_online_users,ethtrader_number_of_post,ethtrader_comments,ethtrader_total_votes,ethfinance_online_users,ethfinance_number_of_post,ethfinance_comments,ethfinance_total_votes,xmrtrader_online_users,xmrtrader_number_of_post,xmrtrader_comments,xmrtrader_total_votes
2021-03-17 13:26:28.073226,926,8,"[{'timestamp': '18 minutes ago', 'comments': '1', 'comments_on_post': ['BTC refuses to scale so LN proponents should build LN as a Bitcoin Cash L2 where it actually has a chance to work.']}, {'timestamp': '42 minutes ago', 'comments': '3', 'comments_on_post': ['Do you have any actionable suggestions here?', ""Checking your mental state and being mentally and attitudinally ready to take action and possibly to move currencies again if necessary IS an action. It's a choice.""]}, {'timestamp': '44 minutes ago', 'comments': '2', 'comments_on_post': ['That’s fucking sick! I need it lmao', 'get the NFT versions!']}, {'timestamp': '49 minutes ago', 'comments': '3', 'comments_on_post': ['""giving out"" or ""printing out""?', ""If people can't withdraw their $1 because of the withdrawal fees, does it matter?"", 'Soo, they invented... a bank?', 'Couldn’t you already do this on Coinbase?']}, {'timestamp': '51 minutes ago', 'comments': '0', 'comments_on_post': []}, {'timestamp': '53 minutes ago', 'comments': '0', 'comments_on_post': []}, {'timestamp': '59 minutes ago', 'comments': '7', 'comments_on_post': ['maybe he didnt received it! try to resend another 5!', ""If you send some BTC you get double back? Obviously a scam. And I don't believe that this really happened to you. There's no way you would have your life savings in BTC and there's no way you would send that to a scam address"", 'I doubt Tesla can help can help you on this', ""There is absolutely nothing you can do. The money is gone i'm afraid. Do you have a link to the transaction id on the blockchain?"", 'SFYL.', ""You learned the hard way not to give your keys to just anyone. Same happened to me in 2017 with 2 BTC. You're out of luck unfortunately."", 'well, you’re dum.']}, {'timestamp': '59 minutes ago', 'comments': '3', 'comments_on_post': ['Damn bro that sucks... I’ll tell you what, send me another 5 btc and I’ll cover the ones you lost plus I’ll send you 10 ETH and 100 doge', 'send me 5 btc, i ll transfert to elon. he s such a cool guy!', 'I hope this is real, great job.']}]",957,9.8k,14,"[{'timestamp': '1 minute ago', 'comments': '0', 'comments_on_post': []}, {'timestamp': '2 minutes ago', 'comments': '0', 'comments_on_post': []}, {'timestamp': '8 minutes ago', 'comments': '2', 'comments_on_post': ['I personally would not do that lulz.', 'I will HODL my GODL Transfer gold to crypto? Nah, Dog. Transfer fiat to crypto? Oh, hecks yeah.']}, {'timestamp': '11 minutes ago', 'comments': '0', 'comments_on_post': []}, {'timestamp': '12 minutes ago', 'comments': '0', 'comments_on_post': []}, {'timestamp': '13 minutes ago', 'comments': '0', 'comments_on_post': []}, {'timestamp': '16 minutes ago', 'comments': '1', 'comments_on_post': ['The article makes sense. I would add that anyone who finds themselves with life changing amounts of bitcoin vs their traditional wealth or lack thereof, should consider taking a loan against their bitcoin rather than selling. This keeps you in your Bitcoin. Even if you have to move some bitcoin onto an exchange to get the loan, it’s better than selling for fiat.']}, {'timestamp': '17 minutes ago', 'comments': '0', 'comments_on_post': []}, {'timestamp': '24 minutes ago', 'comments': '1', 'comments_on_post': ['Yes buy now and keep buying dips. Hodl and keep buying. This is only the beginning', 'Bitcoin is unpredictable; it doesn’t follow any patterns nor can you “time it” like you can in the stock market. Just buy whenever you feel like buying. As long as you DCA is won’t really matter too much if you buy a dip or a peak.']}, {'timestamp': '25 minutes ago', 'comments': '0', 'comments_on_post': []}, {'timestamp': '31 minutes ago', 'comments': '0', 'comments_on_post': []}, {'timestamp': '31 minutes ago', 'comments': '8', 'comments_on_post': ['Buy the dip.', 'lol... well, if a literal (mark)BEAR is telling me to buy... that must be the bear case.', ""I would say if you're doing your own research and it's what you want to do stick with the knowledge you've acquired and make whatever play feels appropriate. If you want a long term position don't worry about a short term bear market, buy whatever dips we have to lower you average cost. I don't see any case for it going to 0 if that's what you're asking. Myself and many others here would buy all 21M before that happens"", 'This is helpful perspective. I figure that it is at least a 5-10 year play for me, so you are probably right about short term bear market. Buy those dips and then get it in a wallet seems like the play.', ""The only viable technical bear case I've found is if our mathematical assumptions about all cryptography was found to be flawed. If would need to be all cryptography as we could simply swap out SHA256 or ECDSA if it was just an issue with those."", 'Ahhh. That is a super helpful! I hadnt thought about that perspective! I will do some digging. Thank you so much!', 'Deflation']}, {'timestamp': '33 minutes ago', 'comments': '1', 'comments_on_post': ['""trust the process"" uhh ok. That doesn\'t mean anything.']}, {'timestamp': '55 minutes ago', 'comments': '2', 'comments_on_post': ['https://old.reddit.com/r/Bitcoin/search?q=wasabi&restrict_sr=on', 'I found this https://old.reddit.com/r/Bitcoin/comments/kvq8ek/ama_im_nopara73_cofounder_of_wasabi_wallet_and/gj09qqx/']}]",19794,2.7k,2,"[{'timestamp': '15 minutes ago', 'comments': '1', 'comments_on_post': ['There are other posts and responses that address it better but—(to my understanding) yes there will likely be improvements because']}, {'timestamp': '26 minutes ago', 'comments': '0', 'comments_on_post': []}]",19697,1.0k,0,[],838,144,1,"[{'timestamp': '20 minutes ago', 'comments': '0', 'comments_on_post': []}]",577,1.4k,7,"[{'timestamp': '3 minutes ago', 'comments': '0', 'comments_on_post': []}, {'timestamp': '5 minutes ago', 'comments': '1', 'comments_on_post': ['😏']}, {'timestamp': '10 minutes ago', 'comments': '1', 'comments_on_post': ['https://www.reddit.com/r/ethtrader/comments/m75axf/greetings/?utm_source=share&utm_medium=ios_app&utm_name=iossmf']}, {'timestamp': '22 minutes ago', 'comments': '0', 'comments_on_post': []}, {'timestamp': '24 minutes ago', 'comments': '2', 'comments_on_post': ['Vitalrick?', '😆🤣😂']}, {'timestamp': '25 minutes ago', 'comments': '1', 'comments_on_post': ['tldr; MetaMask Swaps, a token exchange service integrated into MetaMask, has gone live on mobile devices. Users can swap ETH and a variety of ERC20 tokens directly in their wallets. The mobile version of Swaps comes with the same fees of 0.875% as the desktop version.']}, {'timestamp': '50 minutes ago', 'comments': '5', 'comments_on_post': ['I need another stimulus check...', 'at least you got one!', 'I feel this', 'me: buy @ $2,500 and sell at a loss on the dip', 'DCA', ""My Stimmy was deposited at 9:00 am today. At 9:05 am it was ETH. “...there can be no doubt. Because doubt causes chaos and one's own demise”.""]}]",1664,444,0,[],2035,102,1,"[{'timestamp': '44 minutes ago', 'comments': '3', 'comments_on_post': ['what are some potentials for further market exposure of XMR given several large platforms are anti-privacy?', 'Further exposer is just exposing to friends who are starting out in crypto what xmr is and how private it is. Privacy is something everyone wants no one wants their life to be an open book. I prefer privacy and that’s why I prefer monero, I explain it too my friends as well when they ask about crypto’s', 'After June 2022 when the inflation rate for XMR is lower than BTC, mining switch-over from the latter to the former and better hashrate, will mean Monero is completely decoupled from Bitcoin. This will usher in the era of massive outside investment.']}]",832
2021-03-17 20:19:11.991445,1.1k,5,"[{'timestamp': '1 minute ago', 'comments': '0', 'comments_on_post': ['Wow, amazing 👏🏽👏🏽👏🏽👏🏽👏🏽', 'Glad you like it, I see a real winner, I hope you do too.', 'That’s some beautiful DD', 'Gonna buy more tomorrow.', ""My pleasure! Glad you're on team $DIGI"", 'Top notch, really', 'Not as top as your praise...hope you find it useful!', 'Thank you! Crossed post this into the Digi community hope you don’t mind 🙏', 'I made it to be shared! Hope you find it useful, I think there is real value here...', 'Fantastic work!', 'Glad you like it! What do you think about the company?', 'This company is non stop!!!! 🐂', 'I had to leave off a lot or it just made me look crazy...', 'Awesome bussiness !!! $$$ so much golden nugget in the oven !!!', 'Totally agree!', 'Not all heros wear capes - amazing DD.', 'The penguin wore a top hat and a monocle...he was a villian', '🚀🚀🚀', ""Stan, it's always lovely to see your support, it means a lot to the shareholders."", 'Stan.. Good to see you in here! We appreciate how active you are online.', '$DIGI shareholders consortium on telegram is here', 'Great DD much appreciated', 'My pleasure, thanks for taking the time to look it over.', 'You need more Rockets! 🚀🚀', ""Glad you liked it...we'll have a drink on the moon and selfie the first undisputed lunar landing."", ""Great DD, I'm on board!""]}, {'timestamp': '1 minute ago', 'comments': '0', 'comments_on_post': []}, {'timestamp': '5 minutes ago', 'comments': '0', 'comments_on_post': ['bitfinnex-ed']}, {'timestamp': '20 minutes ago', 'comments': '0', 'comments_on_post': []}, {'timestamp': '47 minutes ago', 'comments': '8', 'comments_on_post': []}]",682,9.2k,14,"[{'timestamp': '1 minute ago', 'comments': '0', 'comments_on_post': []}, {'timestamp': '2 minutes ago', 'comments': '0', 'comments_on_post': []}, {'timestamp': '3 minutes ago', 'comments': '0', 'comments_on_post': []}, {'timestamp': '3 minutes ago', 'comments': '0', 'comments_on_post': []}, {'timestamp': '6 minutes ago', 'comments': '0', 'comments_on_post': []}, {'timestamp': '6 minutes ago', 'comments': '0', 'comments_on_post': []}, {'timestamp': '14 minutes ago', 'comments': '3', 'comments_on_post': ['See 10% of recipients are wise', 'Me', 'While part of me wants to believe this, my other half is saying “ you don’t know any other person that knows what crypto is” 🤷\u200d♂️']}, {'timestamp': '20 minutes ago', 'comments': '1', 'comments_on_post': ['Who knows. There will probably be flood of lost coins if they do though.']}, {'timestamp': '22 minutes ago', 'comments': '8', 'comments_on_post': ['You answered yourself correctly', 'So, if I had $20 worth of btc in 3 address, I would have to pay the on-chain fee on each address to move it?', 'Your wallet will create a transaction that combines all the different bits of bitcoin into one. If you make sure the receiving address is native segwit (it will begin bc1...), you are putting yourself in the best position, fees-wise.', ""okay great, so basically if I'm using segwit addresses, I don't have to worry about massive fees if I have smaller portions in multiple addresses? Am I understanding this correctly?""]}, {'timestamp': '25 minutes ago', 'comments': '5', 'comments_on_post': [""OH SHIT HE'S ONTO US"", 'Chill off?', 'So when do we all become big time billionaires', 'When they print a couple hundred trillion more the dime in your pocket will be worth a million so just save some of those dimes and you’ll be good... 😉']}, {'timestamp': '32 minutes ago', 'comments': '7', 'comments_on_post': ['If there is one thing that the global pandemic has plainly demonstrated is that most politicians and financial analysts are complete idiots.', 'There is only one good reason to go to Bank of America and that is you want to see if they have a public restroom .', 'You’re being as disingenuous as they are, they’re obviously implying there is no value beyond asset value increases.', ""you are looking at it from the angle 1btc is always 1btc. but even from your viewpoint 1btc was 0.0002 pizzas. today it's a porsche. call it an asset or currency or widget. if it didn't increase in value, there would be little incentive to own it. other than perhaps making a political statement."", 'and no good reason to sell it while the fed is printing money', 'The US dollar has lost 99.98% of its value relative to bitcoin.']}, {'timestamp': '36 minutes ago', 'comments': '3', 'comments_on_post': ['You can sell it or wait for Vladimir to allow wallets. Then you can buy on Coinbase Pro, Gemini or another and get a hardware wallet to store it in.', 'You can’t move on Robinhood. You would have to sell and then buy on another platform. I use Coinbase but that is another debate that some would have. I would say it depends on what you have in there as most don’t trust Robinhood. My opinion would be is that if you don’t have much on Robinhood and would not have tax issues with selling then sell. If you would take a tax hit if you sold then leave it and start investing somewhere else until robinhood lets you transfer it.', 'Coinbase and Square are most popular that allow you to take possession of BTC.']}, {'timestamp': '45 minutes ago', 'comments': '1', 'comments_on_post': ['I don’t know anyone who has an exit strategy from bitcoin or crypto in general. The ceiling just isn’t known, the depth of the market is not even close to being discovered. Anyone who gets 100% out is crazy, especially now during a bull run.']}, {'timestamp': '50 minutes ago', 'comments': '6', 'comments_on_post': ['tldr; Bitcoin miners are now producing as much carbon pollution as a medium-sized nation, according to a new study by data scientist Alex de Vries. ""Bitcoin uses more electricity per transaction than any other method known to mankind,"" Microsoft founder Bill Gates said, adding, ""It\'s not a great climate thing."" Australia consumed 192 terrawatt hours (TWh) of electricity in 2020.', ""more posts about bitcoin's energy usage:"", 'seems it has ramped up with the recent price rise.', 'archived article (why?):', 'Key points 2 and 3 on the side of the article are either due to the reporter being grossly misinformed or willfully ignorant.']}]",71818,2.6k,1,"[{'timestamp': '44 minutes ago', 'comments': '0', 'comments_on_post': []}]",962,974,0,[],2015,108,0,[],722,1.7k,11,"[{'timestamp': 'just now', 'comments': '0', 'comments_on_post': []}, {'timestamp': '1 minute ago', 'comments': '0', 'comments_on_post': []}, {'timestamp': '8 minutes ago', 'comments': '0', 'comments_on_post': []}, {'timestamp': '9 minutes ago', 'comments': '1', 'comments_on_post': ['I just broke the game. Bought some more at 1760$ and it just pumped back to 1815$ in 1 hour.']}, {'timestamp': '16 minutes ago', 'comments': '0', 'comments_on_post': []}, {'timestamp': '22 minutes ago', 'comments': '3', 'comments_on_post': ['This is the way!', 'This is the way!', 'Spoiler: Harris Poll conducted in parents basement with 10 participants and 1 moderator.']}, {'timestamp': '28 minutes ago', 'comments': '0', 'comments_on_post': []}, {'timestamp': '40 minutes ago', 'comments': '3', 'comments_on_post': ['Picture knuckles dragging. Me like. \U0001f9a7', 'I’ve never not had this. You’re welcome for my impeccable English.', 'Head and shoulder']}, {'timestamp': '47 minutes ago', 'comments': '4', 'comments_on_post': [""Charting might go out the window with crypto but sideways movement is healthy. If you want a pump and dump you should look at penny stocks. Otherwise higher lows is what you want. Perfect flag patterns. This is a 2 to 5 year hold brotha. Patience. This is coming from someone who just got in at 1800. I'm very comfortable with how eth looks."", 'But shouldnt price change based on news about the network? if not then the upgrades dont seem to be important for the people buying which makes the upgrades pointless, also it can move sideways I get that but considering how big ETH is I expected it to move based on how the project is doing and not depending on BTC climbing or falling', 'Coz feez.']}, {'timestamp': '49 minutes ago', 'comments': '1', 'comments_on_post': ['My lucky charms!']}, {'timestamp': '53 minutes ago', 'comments': '8', 'comments_on_post': ['Bruhh', 'Can u guys see the tattoo or am I retarded?', ""It's the joke, actually. No crypto made him filthy rich."", 'The line work is killer', 'Dude that crypto says chicken noodle soup in Chinese', 'I think I saw a guy on WSB who did that with stonks.', 'you have really nice tiles in your bathroom!', 'A valuable addition to the sub. Another low effort repost.']}]",364,399,0,[],2038,59,0,[],999
2021-03-17 21:37:04.668532,896,1,"[{'timestamp': '41 minutes ago', 'comments': '0', 'comments_on_post': []}]",1207,9.7k,8,"[{'timestamp': '9 minutes ago', 'comments': '10', 'comments_on_post': ['Set the fee lower - like 6 sats/vbyte - & enable RBF. It will take a while to confirm (e.g. maybe a week), but be much cheaper.', 'Should I transfer the funds from my legacy wallet to my segwit wallet?', 'Fees are about 105 sats per byte so the estimation is pretty close. You must be trying to send out a lot of tiny payments combined into one. Ideally you need to wait until fees drop. Or set a lower fee and just wait. Or eat the fee if you gotta send now and get it confirmed fast.', ""I am trying to send out the entire amount in one go. It is $306 estimated fee at 111 sats/byte. It's shown in screenshot."", 'Have you made lots and lots of little inputs into that address?', 'Yes. Many lol. I have been depositing into it in small increments for about a year.', ""is there anything wrong with SafePal? I'm using it as well..."", ""Not really, other than the fact that it's going to cost me $300 to send my BTC out of the wallet LOL.""]}, {'timestamp': '9 minutes ago', 'comments': '2', 'comments_on_post': ['Actually I was trying to explain this to my dad ( he doesn’t understand bitcoin, he says Bitcoin is a casino for the rich people ) I forgive him though, he said that who ever designed cold storage wallets have some type of back door and they are just building trust, but like think about it, really, “they” are just building trust and then one day what? Rake in trillions? I just don’t think that it’s possible for this type of thing to exist, other wise this would have already had happened but who knows', 'multisig']}, {'timestamp': '20 minutes ago', 'comments': '0', 'comments_on_post': []}, {'timestamp': '26 minutes ago', 'comments': '5', 'comments_on_post': ['I like the Satoshi one :)', 'Thank you!', 'Some cool stuff but you don’t accept crypto? Interesting move. Why?', 'Taking it one step at a time my friend! but definitely looking at that']}, {'timestamp': '37 minutes ago', 'comments': '4', 'comments_on_post': ['Finally, Blanch said bitcoin is facing tremendous long-term threats from central bank digital currencies, or CBDCs. There is currently nothing preventing central banks from building their own blockchains and replicating the bitcoin network, and the ECB is reportedly already discussing its own CBDC.', 'Exactly. They’re worried about their multi million dollar a year salary! Btc...de-do shows just how much they’re NOT needed', 'Whatever. You’ll never see Bitcoin involved in something like this.', 'This really deserves an OK Boomer']}, {'timestamp': '42 minutes ago', 'comments': '4', 'comments_on_post': ['Some real smooth brained folks out there heh.', 'Maybe they’ll send it to Elon? 😂', 'It has added value since the government owned it. They bought it for the novelty...', 'This doesn’t check out at all. Bitcoin was no where near 44k during the time this article says the auction occurred.']}, {'timestamp': '49 minutes ago', 'comments': '12', 'comments_on_post': ['Personally, I see it as a long term investment. It’s going to fluctuate, so try not to panic at every dip. But you could also lose every penny, so do what you want.', ""Totally agree. I am most likely just gonna hold on I can afford to lose it. Don't want to but nobody does. However you think this is something that is really going to go up over the months?"", 'Allocate and hold because it will be worth more later, but do whatever you want it’s your money', ""Oh totally. I'm using fun money. I just don't wanna look like a dope lol. However what makes you think it's going to rise? Just historically?"", 'Bitcoins going to 100k this year that’s why. Take out now or take out when it’s 1,000$ more up to you really', ""Yah I'm not concerned about losing I'm just wondering where people get it's gonna be that high by the after two good months. I'm inclined to just ride it out I just want to look smart in front of people lol."", 'Why did you buy it in the first place?', 'Why did you buy it in the first place? Do you have zero tolerance for volatility? Was the expectation that right after you bought in that this thing was going to ""skyrocket?""', 'If you don’t need the funds hold onto it for a while and enjoy the ride 🚀', ""Ya I can get by without them I just don't want it to be something that was just a terrible idea and be embarrassed but you think it's still gonna skyrocket?""]}, {'timestamp': '53 minutes ago', 'comments': '2', 'comments_on_post': ['tldr; Payments processor Visa is set to enter the cryptocurrency market. The payments processor will work with crypto wallet companies to allow users to pay with crypto on Visa credentials. Bitcoin purchases via a Visa card have so far been limited to crypto exchanges or wallets that instantly convert a user’s payment from fiat-to-crypto.', 'Not your keys, not your coins. Mark my words VISA will only play if they hold the keys.']}]",72200,2.3k,3,"[{'timestamp': '38 minutes ago', 'comments': '1', 'comments_on_post': []}, {'timestamp': '49 minutes ago', 'comments': '0', 'comments_on_post': []}, {'timestamp': '52 minutes ago', 'comments': '2', 'comments_on_post': [""POS has it's place in the market (Tezos, Cardano), Proof of work has it's place (Bitcoin, Litecoin, ZCash), and POW/POS hybrid systems have their place (Decred)."", 'I’m only somewhat familiar with PoS']}]",418,842,0,[],2262,122,0,[],1051,1.4k,8,"[{'timestamp': '12 minutes ago', 'comments': '0', 'comments_on_post': []}, {'timestamp': '13 minutes ago', 'comments': '2', 'comments_on_post': [""Let's not act like I was sleeping well and being healthy before I got into crypto haha. Crypto has certainly exacerbated the problem though."", ""well, that's true :D thank you buddy 🥂""]}, {'timestamp': '37 minutes ago', 'comments': '2', 'comments_on_post': ['Maintenance', 'Got ya ... I am glad I missed it then. I probably would have been trying to find somewhere to masturbate if I had seen that live.']}, {'timestamp': '39 minutes ago', 'comments': '2', 'comments_on_post': ['Absolutely! Google each one to find their website and they tell you all about it.', 'Look up smart contracts, and then look up ETH 2.0 and proof-of-stake. Ethereum does a lot more, and will also be under less scrutiny than BTC when the upgrades get rid of environmentally harmful mining.']}, {'timestamp': '41 minutes ago', 'comments': '0', 'comments_on_post': []}, {'timestamp': '54 minutes ago', 'comments': '3', 'comments_on_post': ['7pm PDT happens when this comment is 1 hour and 26 minutes old.', 'AMA is here: https://www.reddit.com/user/CoinbaseListing/comments/m71qrc/hey_reddit_im_brian_armstrong_ceo_and_cofounder/', 'Ask him about aabbg']}, {'timestamp': '56 minutes ago', 'comments': '2', 'comments_on_post': ['Sooner the better', 'If eth looked like this I would eat my own ass in front of my wife and her boyfriend']}, {'timestamp': '58 minutes ago', 'comments': '2', 'comments_on_post': ['7pm PDT happens when this comment is 1 hour and 29 minutes old.', 'Any chance of free limit orders coming back to Coinbase Pro?']}]",578,304,0,[],1954,81,0,[],1119
