Hour,btc_online_users,btc_number_of_post,btc_comments,btc_total_votes,bitcoin_online_users,bitcoin_number_of_post,bitcoin_comments,bitcoin_total_votes,ethereum_online_users,ethereum_number_of_post,ethereum_comments,ethereum_total_votes,monero_online_users,monero_number_of_post,monero_comments,monero_total_votes,dashpay_online_users,dashpay_number_of_post,dashpay_comments,dashpay_total_votes,ethtrader_online_users,ethtrader_number_of_post,ethtrader_comments,ethtrader_total_votes,ethfinance_online_users,ethfinance_number_of_post,ethfinance_comments,ethfinance_total_votes,xmrtrader_online_users,xmrtrader_number_of_post,xmrtrader_comments,xmrtrader_total_votes
03/20/21 08:00 AM,1.0k,6,"[{'timestamp': '8 minutes ago', 'comments': '0', 'comments_on_post': []}, {'timestamp': '12 minutes ago', 'comments': '1', 'comments_on_post': ['source: https://twitter.com/OliCryptoDotCom/status/1371739703045722112']}, {'timestamp': '16 minutes ago', 'comments': '0', 'comments_on_post': []}, {'timestamp': '19 minutes ago', 'comments': '1', 'comments_on_post': ['https://crowdin.com/project/bitcoin-cash']}, {'timestamp': '46 minutes ago', 'comments': '1', 'comments_on_post': ['Found this at getcryptocounter.com by the way']}, {'timestamp': '57 minutes ago', 'comments': '3', 'comments_on_post': ['Article is from 2018', ""Wearing a 'just hold' t-shirt in public, while selling all the stash on the marked. Cool!"", 'https://www.reddit.com/r/btc/comments/9zj2kw/sodl_is_the_new_hodl/']}]",940,7.9k,7,"[{'timestamp': '1 minute ago', 'comments': '0', 'comments_on_post': []}, {'timestamp': '6 minutes ago', 'comments': '1', 'comments_on_post': [""does it matter that they don't know which crypto wallet I use"", 'Add an extra word to the seed phrase to make it a little bit harder to crack.']}, {'timestamp': '15 minutes ago', 'comments': '3', 'comments_on_post': ['The more decentralised wealth is the better!', 'They have coins but they do not have control of the blockchain. There will come a point, in my opinion, where they will need to stop acquiring new coins or reduce their existing balance because if they control too many coins it harms the value. If Tesla, Microstrategy and the twins owned all of the available Bitcoin as an extreme example it would be worthless other than trading it amongst themselves.', 'I personally don’t think it’s good for Bitcoin of microstrategy acquires any more bitcoin. They already own what I would consider an unreasonably large share of total supply as a single entity.']}, {'timestamp': '29 minutes ago', 'comments': '0', 'comments_on_post': []}, {'timestamp': '34 minutes ago', 'comments': '1', 'comments_on_post': ['This is a bitcoin sub. Try r/CryptoCurrency for altcoin topics']}, {'timestamp': '40 minutes ago', 'comments': '4', 'comments_on_post': ['So your telling me that there is a chance?!', 'Great comparison! Here is how i like to discribe it: If you would generate 1 Trillion private keys per second, the sun would burn out before you found a colision. Actually the same is true even if you would 1 Decillion keys per second. :)', 'Also very nice, thanks!', 'This video illustrates it very well']}, {'timestamp': '57 minutes ago', 'comments': '1', 'comments_on_post': ['Since I haven’t heard of it I’m going with a hard no on that one.']}]",1427,2.8k,0,[],10454,975,0,[],715,118,0,[],555,1.4k,3,"[{'timestamp': '15 minutes ago', 'comments': '4', 'comments_on_post': ['Tip this post', ""And then you start cross checking to confirm if it's the actual address"", '""Shouldn\'t I be seeing the money there now?""', '(XKCD btw. The original: https://xkcd.com/612/)']}, {'timestamp': '38 minutes ago', 'comments': '3', 'comments_on_post': ['Tip this post', 'Facts', 'The real scroll of truth 💯']}, {'timestamp': '42 minutes ago', 'comments': '4', 'comments_on_post': ['Tip this post', 'Dinner while watching green dildos and having boner ✅', 'Why is he in colour and imagined up at the very least in the top drawing, and in the bottom he is blank white and bald?', ""I'm trying to achieve both""]}]",318,288,0,[],2675,83,0,[],773
03/20/21 09:17 AM,1.1k,4,"[{'timestamp': 'just now', 'comments': '0', 'comments_on_post': []}, {'timestamp': '1 minute ago', 'comments': '0', 'comments_on_post': []}, {'timestamp': '16 minutes ago', 'comments': '0', 'comments_on_post': []}, {'timestamp': '34 minutes ago', 'comments': '0', 'comments_on_post': []}]",728,8.8k,10,"[{'timestamp': '3 minutes ago', 'comments': '0', 'comments_on_post': []}, {'timestamp': '6 minutes ago', 'comments': '1', 'comments_on_post': [""We have a lot of newcomers entering the Bitcoin space recently who are exploring different exchanges and such. Some users are developing a habit of asking if various random websites some complete stranger PM'd them is a scam or not. Sometimes these sites are completely unrelated to Bitcoin. This is not the purpose of r/Bitcoin.""]}, {'timestamp': '13 minutes ago', 'comments': '0', 'comments_on_post': []}, {'timestamp': '17 minutes ago', 'comments': '4', 'comments_on_post': ['Weekend it has been getting pretty low, at 8 sat/vb right now. Wish it would clear out though so you could do 1 sat/vb', 'Welcome to the weekend, where you can usually get cheap transactions through.', 'I cant really see any clearing lol', 'It is just getting into the low numbers, 1-10 sat/b, area....']}, {'timestamp': '26 minutes ago', 'comments': '3', 'comments_on_post': ['If you use coinbase pro on desktop you should use the mobile app.', 'Coinbase pro is an exchange. Coinbase pleb is a vending service. They work differently. It is better to use an exchange and ignore overpriced vending service.', 'The fees are the main one for me and the Pro has some more in depth chart data like candles etc. However, Coinbase Pro doesn’t have the best charts compared to some other exchanges.']}, {'timestamp': '29 minutes ago', 'comments': '3', 'comments_on_post': ['r/bitcoinbeginners has a lot of info on their front page FAQ', 'Good: Coinbase pro,cash app, kraken', 'https://armantheparman.com/why-bitcoin-only/']}, {'timestamp': '50 minutes ago', 'comments': '2', 'comments_on_post': ['All models are wrong, but some are useful.', 'https://digitalik.net/btc/']}, {'timestamp': '52 minutes ago', 'comments': '3', 'comments_on_post': ['Bitcoin is a peer to peer decentralized payment network.', 'Welcome to the party :)', 'thanks captain obvious']}, {'timestamp': '56 minutes ago', 'comments': '7', 'comments_on_post': ['First you state Economy bad - Bitcoin good', 'How else would you describe Bitcoin at the moment?', 'Closing the economy is relatively easy. Just tell everybody to go home.', 'Is it fair to say that the new generation of business owners are more open to Bitcoin? And the old more pessimistic about it? Of course they have the experience but Bitcoin is only what people value it to be', 'A year ago it plunged 49% in 24 hours to 3,800, that’s how true it is']}, {'timestamp': '57 minutes ago', 'comments': '0', 'comments_on_post': []}]",1739,2.8k,1,"[{'timestamp': '11 minutes ago', 'comments': '2', 'comments_on_post': ['Yes', 'Was this on an exchange?']}]",10404,956,0,[],740,138,0,[],500,1.4k,6,"[{'timestamp': '5 minutes ago', 'comments': '0', 'comments_on_post': []}, {'timestamp': '13 minutes ago', 'comments': '1', 'comments_on_post': ['Tip this post']}, {'timestamp': '20 minutes ago', 'comments': '0', 'comments_on_post': []}, {'timestamp': '42 minutes ago', 'comments': '5', 'comments_on_post': ['Tip this post', 'Guy there with a girl: Again? Keep quiet man let us enjoy the party', ""Don't let them know if you wanna stay safe from wrench attack"", '“You’ve told us like 500 time, stfu”', 'Yeah, I doubt he has 100 ETH.']}, {'timestamp': '59 minutes ago', 'comments': '4', 'comments_on_post': ['I buy eth from Binance and send it to my metamask wallet it cost $5-6, As uniswap cost currently $60.', 'I buyeth eth from binance and sendeth t to mine own metamask chinks holder t did cost $5-6, as uniswap did cost currently $60', 'There’s a option on MetaMask to purchase ETH directly from MetaMask already', 'Shakepay is my fav']}, {'timestamp': '59 minutes ago', 'comments': '3', 'comments_on_post': ['Pancake swaps is bullshit copy and pasted code. Invalidated the entire list', 'Aren’t they all copies? Nothing can compete with eth 😅🤣']}]",14371,372,0,[],2354,82,0,[],429
03/20/21 10:34 AM,1.1k,4,"[{'timestamp': 'just now', 'comments': '0', 'comments_on_post': []}, {'timestamp': '20 minutes ago', 'comments': '5', 'comments_on_post': ['BTC is a ponzi scheme.', '1) Why is Bitcoin Cash using the BTC subreddit instead of BCH? If you have to ask this question, there is a good chance you are new to Bitcoin. During the blocksize debate, many people including miners were in favor of increasing the blocksize capacity of the network. It was around this time that Blockstream started using...', 'This is a bch sub with the wrong name.', 'so? r/Bitcoin is a BTC sub with the wrong name', 'Yup, you might wanna move to r/Bitcoin then because this sub has a hard on for BCH']}, {'timestamp': '39 minutes ago', 'comments': '1', 'comments_on_post': ['The first explorer says there are 25 tx too (only 13). I checked and it looks like the extras are duplicates (same txid). Problem seems to be with the explorer. Actual balance is zero.']}, {'timestamp': '53 minutes ago', 'comments': '5', 'comments_on_post': ['I want to see something done first, before even talking about next fundraising effort.', 'https://github.com/smartbchcheck it here', 'Can you link to official project resource where this address is displayed?', 'you can find it on the bottom of the homepage']}]",698,10.5k,3,"[{'timestamp': '20 minutes ago', 'comments': '0', 'comments_on_post': []}, {'timestamp': '47 minutes ago', 'comments': '9', 'comments_on_post': ['They paid 100+ sats per byte when 1/3 of that would be ok. They did combine over 100 inputs. It was going to be an expensive transaction no matter what. Likely the wallet overestimated 3x for them. People need to learn how to set their own fees.', 'Money laundering.', 'I don\'t understand, how am I the only one able to mine the transaction? Mining the transaction doesn\'t imply to generate a block in the chain to get the reward? How is that a ""privat"" thing?', 'Down-voters broadcasted their transaction and lost the laundered fee.', 'This was always going to be a fairly high fee transaction - it consolidates a great many inputs, such that even at 10 sats/vbyte it would cost about $120 in block space. But the sender is probably non-expert, and trusted some unsophisticated/highballing fee estimation algorithm in their wallet software.', ""There are a great number of inputs, that's why the fee is high. Fee per vbyte was 104 satoshi, which is not unreasonable and has been normal for the past few months. But sure, right now they could've gotten away with 1/10th of that, but why risk it if you're sending 3BTC?""]}, {'timestamp': '50 minutes ago', 'comments': '9', 'comments_on_post': ['Anyway i need to use my crypto visa card from ownr to be able to spend my bitcoins in real world. Feel the difference of usability?', 'It’s more of an asset than a form of spendable currency these days. Digital Gold right? So it’s neat to see BTC overtaking traditional banking methods even if using BTC is impractical.', 'Bad measure really.', 'Well it is. Credit card small, a gold big.', 'Government’s will shutdown crypto, soon or later.. not feeling it anymore', 'Is that how it works? They’ll just “shut it down”?', 'Documenting Bitcoin Tweet', ""sorry but I don't understand why this comparation, bitcoin is not a private company, it's like compare dolar market cap with a private company, sorry if I'm being dumb, but whitch benifits it brings ?"", 'This analogy is not good and just confuses people.']}]",1820,3.0k,1,"[{'timestamp': '28 minutes ago', 'comments': '0', 'comments_on_post': []}]",10437,1.1k,1,"[{'timestamp': '48 minutes ago', 'comments': '8', 'comments_on_post': ['Are you synced?', 'Wallet is synchronized', 'Check the recipient address, if you copy pasted the address it could have been swapped by malicious software.', ""I thought about copy/paste malware, but this is a pretty newly imaged machine I'm working with (not that that's an excuse). I'm looking at Kraken's withdrawal ID and I do see the correct address in there, it matches my Monero GUI receiving address."", ""I had the same problem. Exodus wallet didn't receive it although it was sent. I took the keys from Exodus and opened the wallet in Cake Wallet. Synced Cake Wallet and the XMR was there."", 'Also I did verify the SHA256 hashvalue of my Monero GUI, so I am using the correct version.', 'Can you try this guide?']}]",954,139,0,[],568,1.5k,10,"[{'timestamp': '4 minutes ago', 'comments': '0', 'comments_on_post': []}, {'timestamp': '5 minutes ago', 'comments': '0', 'comments_on_post': []}, {'timestamp': '8 minutes ago', 'comments': '1', 'comments_on_post': ['ETH gas fees are truly ridiculous right now. So let’s at least put ETH aside for the time being with regard to your question.']}, {'timestamp': '28 minutes ago', 'comments': '2', 'comments_on_post': ['Tip this post', 'Let them earn Bro it will not last longer as POS is coming next year']}, {'timestamp': '30 minutes ago', 'comments': '0', 'comments_on_post': []}, {'timestamp': '31 minutes ago', 'comments': '0', 'comments_on_post': []}, {'timestamp': '37 minutes ago', 'comments': '0', 'comments_on_post': []}, {'timestamp': '44 minutes ago', 'comments': '5', 'comments_on_post': ['Tip this post', 'Weirdo', 'Okay buddy.']}, {'timestamp': '51 minutes ago', 'comments': '4', 'comments_on_post': [""I can't wait to watch people regret not hoping unto ETH early"", 'I just got into it this year so you’re thinking I’m right on time?', ""I can assure you that in the next few years people who didn't buy in will be filled with regret"", 'Should one stake their eth? What’s the benefit']}, {'timestamp': '55 minutes ago', 'comments': '1', 'comments_on_post': [""Just my personal opinion, but at a ratio of .03, there's an extremely high likelihood that you will have the opportunity to sell your ETH back to BTC at a profit at some point.""]}]",14413,463,1,"[{'timestamp': '32 minutes ago', 'comments': '0', 'comments_on_post': []}]",1939,78,0,[],422
03/21/21 02:33 AM,1.1k,2,"[{'timestamp': '15 minutes ago', 'comments': '1', 'comments_on_post': ['Of course']}, {'timestamp': '32 minutes ago', 'comments': '0', 'comments_on_post': []}]",804,7.1k,3,"[{'timestamp': '16 minutes ago', 'comments': '1', 'comments_on_post': ['This not cryptocurrency sub. Ban.']}, {'timestamp': '17 minutes ago', 'comments': '1', 'comments_on_post': ['Man wtf....']}, {'timestamp': '42 minutes ago', 'comments': '5', 'comments_on_post': ['Top of this cycle is 7 or 8 months away, wait until then.', ""I feel like Aug or Sept so 6 months or less. Let's see what happens."", 'My calculation is September, and my initial plan was to take out my investment in July-August.', 'Only if', 'Nobody can predict the future. Nothing says bitcoin will not go to zero.']}]",67553,2.6k,0,[],23997,958,1,"[{'timestamp': '3 minutes ago', 'comments': '0', 'comments_on_post': []}]",1013,127,0,[],562,1.0k,11,"[{'timestamp': '3 minutes ago', 'comments': '0', 'comments_on_post': []}, {'timestamp': '6 minutes ago', 'comments': '0', 'comments_on_post': []}, {'timestamp': '8 minutes ago', 'comments': '1', 'comments_on_post': ['Where do you get one?']}, {'timestamp': '8 minutes ago', 'comments': '1', 'comments_on_post': ['Tip this post']}, {'timestamp': '12 minutes ago', 'comments': '1', 'comments_on_post': ['Tip this post']}, {'timestamp': '17 minutes ago', 'comments': '0', 'comments_on_post': []}, {'timestamp': '21 minutes ago', 'comments': '2', 'comments_on_post': ['Ethereum bulls may reemerge after March $1.15B ETH options expiry', 'That’s a ton of money in options']}, {'timestamp': '32 minutes ago', 'comments': '0', 'comments_on_post': []}, {'timestamp': '40 minutes ago', 'comments': '6', 'comments_on_post': ['😳', 'Fortunately it seems like they were doing it several years ago, but that would’ve included during the epic 2017-2018 bullrun.', 'Coinbase Settles With CFTC for $6.5M Over Old Trading Practices', 'Weird, why would they do that? And what would they gain out of it?', 'Yeah it’s weird. They have so much volume already that I don’t understand why they would need to do this. I wonder if this fine is related to them delaying their IPO too', 'They could be doing it now and people would know 2 years later.']}, {'timestamp': '50 minutes ago', 'comments': '3', 'comments_on_post': ['No, network upgrades sometimes cause hare forks but the forked chain dies because nobody mines it. There are only two sustainable forks when miners mine both. This rarely happens unless there’s contention and likely won’t happen here. Also the fork in this case would immediately implode because defi assets on it would be broken and generally worthless as they have no utility anymore, stable coins would break and NFTs useless on the forked chain.', 'Is eip-1559 not contentious though? From what ive seen, it seems that a lot miners dont want this update to take place and will likely keep mining on the old protocol. Which means the chain wont die, at least not immediately.']}, {'timestamp': '59 minutes ago', 'comments': '2', 'comments_on_post': ['What hardware wallet(s) would you recommend?', 'Meta mask.']}]",1080,423,2,"[{'timestamp': '24 minutes ago', 'comments': '4', 'comments_on_post': ['You haven’t done this yet?', ""You don't have any long term plans with your GF? Maybe she's disappointed you don't want to wife her and settle with her."", ""She is in Europe and can't settle with me for another 2 years while she finishes school, but yeah, she isn't thrilled by the thought of PR yet. If I move to Europe, I (likely) lose a lot of income, and I'm not willing to do that yet."", ""I think it's a great plan, personally. The way you've set up your current investments tells me you'd be smart about it. I'd put some money into bitcoin too though. Maybe 80% eth 20% bitcoin. You're at the right age to take big risks.""]}, {'timestamp': '26 minutes ago', 'comments': '11', 'comments_on_post': ['So I still think this is an interesting chart: https://www.tradingview.com/chart/ETHUSD/DCxv2gir-ETH-and-BTC-as-a-twin-asset-Metcalfe-s-Law/', ""Everyday I convince myself again that ADA is the new XRP. I can't believe more people don't talk about the obvious tactic of making a giant supply of coins to attract noobs and make them drown in hopium."", ""Total number of coins doesn't really matter -- ETH or BTC would be just as effective with only 1 coin total if you could divide it to 100 decimal places. The problem is, most peoples' brains aren't trained to intuitively understand value that way; whole numbers are easier."", ""Can't add anything other than I had to explain this to some very dense people on Twitter. It's crazy tbh"", 'I thought we had agreed we were going up, not down?', '""I am altering the deal. Pray I do not alter it any further.""', 'Ethereum.', 'Ethereum', ""Dude. You're a fuckin robot, I swear.""]}]",2732,58,0,[],913
03/21/21 03:50 AM,1.0k,2,"[{'timestamp': '7 minutes ago', 'comments': '1', 'comments_on_post': ['Lower confirmation times can lead to a higher uncle rate']}, {'timestamp': '37 minutes ago', 'comments': '1', 'comments_on_post': ['I can solve your phone problem if you want']}]",831,7.8k,8,"[{'timestamp': '1 minute ago', 'comments': '0', 'comments_on_post': []}, {'timestamp': '12 minutes ago', 'comments': '4', 'comments_on_post': ['r/BitcoinBeginners', ""Nobody who understands it asks that. It's like saying can't the entire Internet go down? Yeah... in some bad ass black Swan event but if you're going about life trying to anticipate unknown unknowns, you're gonna waste a lot of time and be very unhappy."", ""i don't think a network with more redundancy has ever existed. the internet could be shut down entirely, and bitcoin could still function. not that it wouldn't be a problem..."", 'No.', '']}, {'timestamp': '14 minutes ago', 'comments': '0', 'comments_on_post': []}, {'timestamp': '16 minutes ago', 'comments': '2', 'comments_on_post': ['B or C :)', 'Welcome to the future']}, {'timestamp': '18 minutes ago', 'comments': '20', 'comments_on_post': ['That’s just crazy to think people are carrying around that much money on their phones.', 'You made zero effort to understand how to secure your bitcoin, from the wallet you chose (blockchain.info is scam site) to ignoring the instructions on how to recover funds.', ""Yeah was talked into buying from a co worker. Thought I was all set and started seeing some gains. Sucks, not sure I'll invest again if I do it will be something else."", 'talking about self harm is a good way to get banned.', 'Give the guy a break. It was 3 months ago, he said he almost did something. He didn’t do it. He’s not saying that he will do it.', 'Because ppl like you take everything so literally I changed it. Jeezus dude', 'U bought it on the exchange? If so, they have records', 'Yeah on coinbase and sent it to my blockchain wallet', 'Do u still have the key words of your wallet?', ""I don't remember ever getting key words"", 'Didn’t you have an account on Blockchain.com that was connected with your Bitcoin address?', ""The blockchain app just asks for an email to sign up. To recover the funds I need the key phrases which I never got or didn't write down as I thought I could just log in with my email"", '? Go figure out how to restore it', ""I've tried everything for a month straight""]}, {'timestamp': '31 minutes ago', 'comments': '0', 'comments_on_post': []}, {'timestamp': '36 minutes ago', 'comments': '2', 'comments_on_post': ['bitcoin is a trustless bank note. but you need to check the network to verify it.', 'The entire point of having a bank store your cash is because you trust their infrastructure.']}, {'timestamp': '39 minutes ago', 'comments': '4', 'comments_on_post': ['yes. find a seller who wants it.', 'even if u spen minority... u will regret it later. Just like how i sold 3 Bitcoin to get a car at 6k each in 2019 or 2020. now each time i look at my 18k car. i say its 180k car', 'One day that will be a $3M car', 'I actually own a big chunk of eth so if I could figure out how to legally and safely buy a house with eth that would be cool too.']}]",35475,2.0k,0,[],24113,1.1k,0,[],976,135,0,[],535,1.3k,10,"[{'timestamp': '1 minute ago', 'comments': '0', 'comments_on_post': []}, {'timestamp': '2 minutes ago', 'comments': '0', 'comments_on_post': []}, {'timestamp': '7 minutes ago', 'comments': '4', 'comments_on_post': ['Tip this post', 'DeFi is open 24/7', 'DEFI RUNS ON ETHEREUM', 'Even when I do get some sleep,first thing I do when I wake up is check my portfolio']}, {'timestamp': '11 minutes ago', 'comments': '0', 'comments_on_post': []}, {'timestamp': '18 minutes ago', 'comments': '1', 'comments_on_post': ['Ethereum Developer Shows That the Benefits of EIP-1559 and PoS Are Yet To Price into ETH']}, {'timestamp': '21 minutes ago', 'comments': '3', 'comments_on_post': ['It makes me feel whole', 'Kills depression', 'My portfolio looks real good if ETH hits one million dollars']}, {'timestamp': '25 minutes ago', 'comments': '0', 'comments_on_post': []}, {'timestamp': '25 minutes ago', 'comments': '3', 'comments_on_post': ['Tip this post', 'My gut says your right', 'My gut says your gut is right!']}, {'timestamp': '46 minutes ago', 'comments': '2', 'comments_on_post': ['The guy is a literal genius', 'World class genius indeed!']}, {'timestamp': '48 minutes ago', 'comments': '2', 'comments_on_post': ['Tip this post', 'This is an awfully specific meme. You okay OP?']}]",554,372,0,[],2733,74,1,"[{'timestamp': '44 minutes ago', 'comments': '0', 'comments_on_post': []}]",791
